{"$schema":"https://json-schema.org/draft/2020-12/schema","$id":"https://ai-sdlc.dev/schema/operator/store/feature-claim.schema.json","title":"Immutable active Feature claim","type":"object","required":["claim_id","target_repository","feature_id","operation_id","operation_generation","expected_revision","idempotency_key","created_at","trusted_context_digest"],"properties":{"claim_id":{"type":"string"},"target_repository":{"type":"string"},"feature_id":{"type":"string"},"operation_id":{"type":"string"},"operation_generation":{"type":"integer","minimum":0},"expected_revision":{"type":"integer","minimum":0},"idempotency_key":{"type":"string","minLength":1,"maxLength":256},"created_at":{"type":"string"},"trusted_context_digest":{"type":"string"}},"additionalProperties":false}
