{"claim_id":"fc-3ca4d8517d8639c30e52141d79887b3403d080d5","created_at":"2026-09-26T16:02:51Z","expected_revision":1,"feature_id":"F-OPERATOR-V03-REAL-RUNTIME-FI-0028","idempotency_key":"v03-release-fi-lost-ack-713ddcda2c19fdf5ae424cdcb7d096865c5fbad7","operation_generation":0,"operation_id":"op-91bcb2f91adb0a403a86c6b371f23b684cdf21b5","target_repository":"dream-xin/ai-sdlc","trusted_context_digest":"trusted-runtime"}
