{"claim_id":"fc-1589077c713958934c650c39518ed5ac5097e2bc","created_at":"2026-09-26T14:23:31Z","expected_revision":3,"feature_id":"F-OPERATOR-V03-REAL-RUNTIME-FI-0026","idempotency_key":"v03-release-fi-launch-auth-before-cancel","operation_generation":0,"operation_id":"op-d11bf451df40573b20520ffeb5f70da8677db8d8","target_repository":"dream-xin/ai-sdlc","trusted_context_digest":"trusted-runtime"}
