{"claim_id":"fc-18a37b0fe6fc4f1f7f56da13be63e8c10b4faf3d","created_at":"2026-10-02T07:21:25Z","expected_revision":1,"feature_id":"F-OPERATOR-V03-REAL-RUNTIME-FI-0046","idempotency_key":"v03-release-fi-lost-ack-d6e94b345249d6be650fd5ca22ee44a743ac5a6e","operation_generation":1,"operation_id":"op-5d48298138da23ae8959accdbf9199b62a3183b0","target_repository":"dream-xin/ai-sdlc","trusted_context_digest":"f0f0615cfa3510d55214b8e05baac43e072423bf9db49c161d2b00a4bb3d7861"}
