{"claim_id":"fc-2df4f7937c7c2c3430516b513077c66051c5ee08","created_at":"2026-09-26T11:10:22Z","expected_revision":1,"feature_id":"F-OPERATOR-V03-REAL-RUNTIME-FI-0022","idempotency_key":"v03-release-fi-lost-ack-a4a55e062f93a7c8b0b3cad2ab0832f55007b997","operation_generation":0,"operation_id":"op-4d708dad60eb2d53dec42ec202fc7f4bda9fa474","target_repository":"dream-xin/ai-sdlc","trusted_context_digest":"trusted-runtime"}
