{"claim_id":"fc-86f51fe32d3f5158c6f31ac00d8453c1e9bede0b","created_at":"2026-10-02T10:54:10Z","expected_revision":1,"feature_id":"F-OPERATOR-V03-FI-DUPLICATE-WORKER-0001","idempotency_key":"v03-release-fi-duplicate-worker-completion","operation_generation":0,"operation_id":"op-b606e60626ad209c5caeea9f7fcb6ff56eff3c7a","target_repository":"dream-xin/ai-sdlc","trusted_context_digest":"trusted-runtime"}
