{"claim_id":"fc-5c09a6bc25084f6fe11de463e457b34c3190e835","created_at":"2026-09-25T15:39:40Z","expected_revision":1,"feature_id":"F-OPERATOR-V03-REAL-RUNTIME-FI-0013","idempotency_key":"v03-release-fi-lost-ack-684e4c8d0630f53622406ff9b33b054cebd181dd","operation_generation":1,"operation_id":"op-c5a5f28801839f7d8722f913b72b8122efa0f044","target_repository":"dream-xin/ai-sdlc","trusted_context_digest":"4a12784a26b1a12feeadd583346b3e99752445cafe32d1d235794c3bc4bcd46a"}
