{"claim_id":"fc-28be48e6d7dd57f4720eb0f3cf3af638a9aa68f0","created_at":"2026-10-02T11:20:57Z","expected_revision":1,"feature_id":"F-OPERATOR-V03-REAL-RUNTIME-FI-0050","idempotency_key":"v03-release-fi-lost-ack-c2a5661953820c53e344c4e7bb0214e53d6df4eb","operation_generation":1,"operation_id":"op-65324ea55824ef3a738282a5985adc7fc4692d31","target_repository":"dream-xin/ai-sdlc","trusted_context_digest":"f8a6fc8cffb297380009d8202f7d8dff645ac62285624c88d1b57620275590cb"}
