{"claim_id":"fc-d1fb766b7e2377ff27bef96a8f5f67ada4fffc73","created_at":"2026-10-02T11:43:51Z","expected_revision":1,"feature_id":"F-OPERATOR-V03-FI-UNKNOWN-TAKEOVER-0008","idempotency_key":"v03-release-fi-unknown-takeover-r9","operation_generation":1,"operation_id":"op-9c2e99c98e0d760810b0d49738281376d920b949","target_repository":"dream-xin/ai-sdlc","trusted_context_digest":"5809edf5eec44c3bcaba7ec75ee24d98f644daefe6710458a6652e0c1ba45ddb"}
