{"claim_id":"fc-d68d68ff5e640aee2176b3cfdf1fa84e8dec328f","created_at":"2026-09-25T09:37:49Z","expected_revision":1,"feature_id":"F-OPERATOR-V03-REAL-RUNTIME-FI-0008","idempotency_key":"v03-release-fi-lost-ack-7d2ae55e1bab483b7c682f3a3a237fcc82d3f270","operation_generation":1,"operation_id":"op-5550b63e32adab052447b7c6a377b6251f278171","target_repository":"dream-xin/ai-sdlc","trusted_context_digest":"efa58293a75ab8c8180a8369a8f152e813a475a8b770c1214c2b9293dde0792f"}
