{"claim_id":"fc-b1f1f1b104c043637034b323d77eb2f74abbdf2c","created_at":"2026-09-25T02:16:15Z","expected_revision":1,"feature_id":"F-OPERATOR-V03-REAL-RUNTIME-FI-0004","idempotency_key":"v03-release-fi-lost-ack-a90ebdfc92d92bfb4d06234d14eee6c6e58eb320","operation_generation":1,"operation_id":"op-cf5a6da01e3c494f7e3644ebde8ad7beb6537356","target_repository":"dream-xin/ai-sdlc","trusted_context_digest":"a41ebcece5ec1f7c5cf402156b2575d1682fea4337a13a60979a71f382e531a8"}
