{"claim_id":"fc-bae870e2117b3a96727fb36298875898edb91114","created_at":"2026-10-02T12:20:21Z","expected_revision":1,"feature_id":"F-OPERATOR-V03-FI-PERSIST-BEFORE-CANCEL-0002","idempotency_key":"v03-release-fi-persist-linearized-before-cancel-r2","operation_generation":0,"operation_id":"op-3ddc7b9ec2cfce56ba924e4a855ff046cfa3b8a1","target_repository":"dream-xin/ai-sdlc","trusted_context_digest":"trusted-runtime"}
