{"claim_id":"fc-a78e49d8f40304693638fe0db0f3559b019f7521","created_at":"2026-09-27T17:50:19Z","expected_revision":1,"feature_id":"F-OPERATOR-V03-REAL-RUNTIME-FI-0040","idempotency_key":"v03-release-fi-lost-ack-5862ce26b34de4f6453fa62efb3a094ff519c473","operation_generation":0,"operation_id":"op-29aa73409258c0a10d342ba91f960b086c94bf92","target_repository":"dream-xin/ai-sdlc","trusted_context_digest":"trusted-runtime"}
