{"claim_id":"fc-cc06d0ae5a06e4d4be699bf2c1b12fa64c08c355","created_at":"2026-10-02T15:42:46Z","expected_revision":1,"feature_id":"F-OPERATOR-V03-FI-OUT-OF-ORDER-CALLBACK-0003","idempotency_key":"v03-release-fi-out-of-order-callback-r3","operation_generation":1,"operation_id":"op-a2927cda8d429d81344e20fb34a60faa4bdd675f","target_repository":"dream-xin/ai-sdlc","trusted_context_digest":"a42d64d0c164476a0efb2a8e6e3b9738174f56ada3251ba2a3ad77c150964ae3"}
