{"claim_id":"fc-3852b0824769c5f550a5d9ed071814cf9a904026","created_at":"2026-09-26T15:03:00Z","expected_revision":1,"feature_id":"F-OPERATOR-V03-FI-UNKNOWN-TAKEOVER-0001","idempotency_key":"v03-release-fi-unknown-takeover-r2","operation_generation":0,"operation_id":"op-8f5b7fd38007506a3b258746bcdef565c864273d","target_repository":"dream-xin/ai-sdlc","trusted_context_digest":"trusted-runtime"}
