{"claim_id":"fc-83b1928280ae5a4e556183c1298ee5f304f5d815","created_at":"2026-09-26T12:03:56Z","expected_revision":1,"feature_id":"F-OPERATOR-V03-REAL-RUNTIME-FI-0024","idempotency_key":"v03-release-fi-lost-ack-502f0700390197b24e066bc42349f468bce9082a","operation_generation":1,"operation_id":"op-2192427a991fe08afdf524e2653d09ec10fe7857","target_repository":"dream-xin/ai-sdlc","trusted_context_digest":"90fc92b779421c7d884af0b8096f7503c7b9507a0f2ce77bc452357c82f6203d"}
